{
  "$schema": "https://json-schema.org/draft/2020-12/schema",
  "$id": "https://github.com/vibecook-dev/puppeteer/packages/surface/upstream.schema.json",
  "title": "Coding-agent upstream release detector",
  "type": "object",
  "additionalProperties": false,
  "required": [
    "schemaVersion",
    "vendor",
    "repository",
    "detectors",
    "platforms",
    "acquisition",
    "analysis",
    "debounce"
  ],
  "properties": {
    "$schema": { "type": "string" },
    "schemaVersion": { "const": 1 },
    "vendor": { "type": "string", "pattern": "^[a-z][a-z0-9-]*$" },
    "repository": { "type": "string", "format": "uri" },
    "sourceRelation": {
      "oneOf": [
        {
          "type": "object",
          "additionalProperties": false,
          "required": ["strategy", "template"],
          "properties": {
            "strategy": { "const": "release-tag" },
            "template": {
              "type": "string",
              "pattern": "\\$\\{(?:version|tag)\\}"
            }
          }
        },
        {
          "type": "object",
          "additionalProperties": false,
          "required": ["strategy", "path"],
          "properties": {
            "strategy": { "const": "source-revision-file" },
            "path": { "type": "string", "pattern": "^(?!\\.{1,2}$)[A-Za-z0-9._-]+$" }
          }
        }
      ]
    },
    "detectors": { "type": "array", "minItems": 1, "items": { "type": "object" } },
    "platforms": { "type": "array", "minItems": 1, "items": { "type": "string" } },
    "acquisition": {
      "oneOf": [
        {
          "type": "object",
          "additionalProperties": false,
          "required": ["strategy", "allowedHosts", "maxBytes", "artifacts"],
          "properties": {
            "strategy": { "const": "https-template" },
            "allowedHosts": { "type": "array", "minItems": 1, "items": { "type": "string" } },
            "maxBytes": { "type": "integer", "minimum": 1, "maximum": 1073741824 },
            "artifacts": {
              "type": "object",
              "additionalProperties": {
                "type": "object",
                "additionalProperties": false,
                "required": ["urls", "format", "executableBasenames"],
                "properties": {
                  "urls": {
                    "type": "array",
                    "minItems": 1,
                    "items": { "type": "string", "pattern": "^https://.*\\$\\{version\\}" }
                  },
                  "format": { "enum": ["binary", "tar.gz", "zip"] },
                  "executableBasenames": {
                    "type": "array",
                    "minItems": 1,
                    "items": { "type": "string", "pattern": "^(?!\\.{1,2}$)[A-Za-z0-9._-]+$" }
                  }
                }
              }
            }
          }
        },
        {
          "type": "object",
          "additionalProperties": false,
          "required": ["strategy", "allowedHosts", "maxBytes", "sourceArchive", "installedConsole"],
          "properties": {
            "strategy": { "const": "source-revision" },
            "allowedHosts": { "type": "array", "minItems": 1, "items": { "type": "string" } },
            "maxBytes": { "type": "integer", "minimum": 1, "maximum": 1073741824 },
            "sourceArchive": {
              "type": "object",
              "additionalProperties": false,
              "required": ["urls", "format", "rootFiles", "maxExtractedBytes"],
              "properties": {
                "urls": {
                  "type": "array",
                  "minItems": 1,
                  "items": {
                    "type": "string",
                    "pattern": "^https://.*\\$\\{(?:version|tag)\\}"
                  }
                },
                "format": { "enum": ["tar.gz", "zip"] },
                "rootFiles": {
                  "type": "array",
                  "minItems": 1,
                  "items": {
                    "type": "string",
                    "pattern": "^(?!\\.{1,2}(?:/|$))(?!.*\\/\\.{1,2}(?:\\/|$))[A-Za-z0-9._-]+(?:/[A-Za-z0-9._-]+)*$"
                  }
                },
                "maxExtractedBytes": { "type": "integer", "minimum": 1, "maximum": 4294967296 }
              }
            },
            "installedConsole": {
              "type": "object",
              "additionalProperties": false,
              "required": [
                "strategy",
                "pythonVersion",
                "uvVersion",
                "projectFile",
                "lockFile",
                "distribution",
                "consoleScript",
                "installMode",
                "generatedSourcePaths",
                "versionOutput",
                "isolatedHomeEnvironment"
              ],
              "properties": {
                "strategy": { "const": "python-uv-lock" },
                "pythonVersion": { "type": "string", "pattern": "^3\\.\\d+\\.\\d+$" },
                "uvVersion": { "type": "string", "pattern": "^\\d+\\.\\d+\\.\\d+$" },
                "projectFile": {
                  "type": "string",
                  "pattern": "^(?!\\.{1,2}(?:/|$))(?!.*\\/\\.{1,2}(?:\\/|$))[A-Za-z0-9._-]+(?:/[A-Za-z0-9._-]+)*$"
                },
                "lockFile": {
                  "type": "string",
                  "pattern": "^(?!\\.{1,2}(?:/|$))(?!.*\\/\\.{1,2}(?:\\/|$))[A-Za-z0-9._-]+(?:/[A-Za-z0-9._-]+)*$"
                },
                "distribution": { "type": "string", "pattern": "^(?!\\.{1,2}$)[A-Za-z0-9._-]+$" },
                "consoleScript": { "type": "string", "pattern": "^(?!\\.{1,2}$)[A-Za-z0-9._-]+$" },
                "installMode": { "enum": ["editable", "non-editable"] },
                "generatedSourcePaths": {
                  "type": "array",
                  "uniqueItems": true,
                  "items": {
                    "type": "string",
                    "pattern": "^(?!\\.{1,2}(?:/|$))(?!.*\\/\\.{1,2}(?:\\/|$))[A-Za-z0-9._-]+(?:/[A-Za-z0-9._-]+)*$"
                  }
                },
                "versionOutput": { "enum": ["single-line", "first-line"] },
                "isolatedHomeEnvironment": {
                  "type": "array",
                  "uniqueItems": true,
                  "items": {
                    "type": "string",
                    "pattern": "^[A-Z][A-Z0-9_]*$",
                    "not": {
                      "enum": [
                        "COMSPEC",
                        "HOME",
                        "HTTP_PROXY",
                        "HTTPS_PROXY",
                        "LANG",
                        "LC_ALL",
                        "NO_COLOR",
                        "NO_PROXY",
                        "PATH",
                        "PATHEXT",
                        "PYTHONDONTWRITEBYTECODE",
                        "SSL_CERT_DIR",
                        "SSL_CERT_FILE",
                        "SYSTEMROOT",
                        "SystemRoot",
                        "TEMP",
                        "TMP",
                        "TMPDIR",
                        "USERPROFILE",
                        "UV_NO_ENV_FILE",
                        "UV_NO_PYTHON_DOWNLOADS",
                        "UV_PROJECT_ENVIRONMENT",
                        "WINDIR"
                      ]
                    }
                  }
                }
              }
            }
          }
        }
      ]
    },
    "analysis": { "type": "array", "minItems": 1, "items": { "type": "string" } },
    "debounce": {
      "type": "object",
      "required": ["polls", "minutes"],
      "properties": {
        "polls": { "type": "integer", "minimum": 1 },
        "minutes": { "type": "integer", "minimum": 0 }
      }
    }
  }
}
